ID,Name,ReviewCount,Brand,ImageURL,Rating,Description,Category,Price
328ca136ce6a4c0fd133c49582938234,"CAREFREE Acti-Fresh Body Shape Thin To Go Pantiliners, Unscented 22 ea (Pack of 2)",No Reviews Yet,carefree,https://i5.walmartimages.com/asr/a422aa1a-9a19-4eac-b0f3-761be136eaa2_1.9c026288d830a3a3a78fc027d964800e.jpeg,No Ratings Available,Pack of 2 Pack of 2 for the UPC: 078300069911 Heading ManufacturerJ & J,"personal, care, feminine, care, carefree",678.0
4aef43b17bac75f1d31504ece13992be,WEB FilterFresh Whole Home Ocean Mist Air Freshener,2.0,"web, products",https://i5.walmartimages.com/asr/375573d7-3ace-4639-9c63-5b58c378948a_1.4805328b4b15e88747e6aa817c0402bd.jpeg,No Ratings Available,"Is your home being overrun by unpleasant odors? Whether you own a pet, frequently cook or live with a smoker, Protect Plus Industries The Web Filter Fresh Whole Home Ocean Mist Air Freshener is all you need to keep your entire home smelling great for days. The secret to the Filter Fresh pads effectiveness lies in an odor counteractant that works with fragrance to combat your homes most unpleasant odors. Coming in a fresh, clean scent of ocean mist, this air freshener perfectly accommodates an apartment, home or office, filling the entire space with a special odor-fighting formula. Have small areas that could use a little refresher? The Filter Fresh air freshener can handle that too, eliminating odors in closets, bathrooms and even your car. And it couldnt be easier to use: Simply attach the Filter Fresh pads to any size filter on a central furnace or AC unit. It will even work on electrostatic filters, but dont use the pads on these types of filters if it is directly connected to your households electrical currents. Have an oscillating fan? Then you can connect Filter Fresh to the front of it, allowing you to pleasantly scent one room at a time. For days of cool ocean mist to revive your stale office, apartment or closet, use Protect Plus Industries The Web Filter Fresh Whole Home Ocean Mist Air Freshener. WEB FilterFresh whole home air freshener attaches to any furnace or air conditioner filter. The secret to a pleasant smelling house! As the central furnace/AC system runs a ocean breeze scent fills your home. Great for parties, open houses, holidays and to help reduce lingering household odors like smoke, kitchen, bathroom and pet odors. Safer than candles and FilterFresh lasts longer than aerosol sprays. Scents last for days depending on the size of your home and how much the system is running. Comes with one air freshener in ocean mist scent Air freshener masks odors throughout your entire home, office or apartment Easily attaches to any furnace or air conditioner filter Air freshener lasts for days Works great in small areas like cars, closets and bathrooms","household, essentials, air, fresheners",1046.0
015f1020a41d6e9f98cf93e5ac5c8109,"Right Guard Sport Deodorant Aerosol Spray, Fresh, 8.5 Oz",12.0,"right, guard",https://i5.walmartimages.com/asr/b960e6c1-2f85-46f3-acb8-3f8686ecd4f6_1.366b236d1e42be44890aa9793b7a0d29.jpeg | https://i5.walmartimages.com/asr/44931ee9-28c9-41a7-872d-3a1fc5bf1d24_1.57344cdc546c134263b305f1c84602f4.jpeg | https://i5.walmartimages.com/asr/1390e2e3-95b6-4c02-8294-f6ead26d3c80_1.938c95a8010b134aa334000acd2d369f.jpeg | https://i5.walmartimages.com/asr/cec4dea6-5369-457e-9624-20e247051eeb_1.e3cb4aead52b8faf174a1c4c8843a1ef.jpeg | https://i5.walmartimages.com/asr/96291b77-100e-45ff-bd92-2b1f3c2c107f_1.6775508f298e14bea8b15f266bc1fb1a.jpeg,3.7,"Right Guard Sport Fresh Deodorant provides all-day protection against perspiration odor, helps protect your clothes with its anti-stain formulation, and dries on contact.       Right Guard Sport Fresh Deodorant 8.5 oz. Aerosol Can: Steel Right Guard sport aerosol deodorant fresh Meets EPA clean air standards *Based on unit sales The distinctive design and elements of this package are proprietary and owned by The Dial Corporation, A Henkel Company Please recycle","personal, care, men, essentials, men, bath, body",1052.0
ea54402b2dc8ed8825d88b3417075ccb,"Garnier Whole Blends Smoothing Shampoo with Coconut Oil & Cocoa Butter Extracts, 12.5 fl. oz.",9799.0,garnier,https://i5.walmartimages.com/asr/70da3e89-1984-453b-ba60-5ea7dee290cf.f3799dd715cfb199d2e33160fb334b7b.jpeg | https://i5.walmartimages.com/asr/ce4fab48-5340-4172-8e78-2927ab66d8e4.99fabfc0769a48209fa418e3ed51fdc5.jpeg | https://i5.walmartimages.com/asr/ab7e3077-d950-45f3-8ae4-37a424c29296.db20a51fb59ede9e76f70a39cbb67eaa.jpeg | https://i5.walmartimages.com/asr/89a4da47-100e-467b-bf3a-7e9165b3f97c.be106f7148b3a51200367e5688cff1d0.jpeg | https://i5.walmartimages.com/asr/3bdceb77-1eec-47aa-a0b6-834a9b02514e.94d6c9052940b00bf6eabc927dbdd975.jpeg | https://i5.walmartimages.com/asr/e08f0ff3-2c04-496f-8c28-f41a5d7a0b2e.13860206321c23bbf0e8423cb33096e1.jpeg | https://i5.walmartimages.com/asr/e422f63f-f8cf-454d-a21e-0dbe7853f3ae.943c0e2d0abf44f1fcd35731090bca65.jpeg | https://i5.walmartimages.com/asr/8d1b2234-b5b5-4a89-98ab-634c94c066e9_1.bc3745a7aa5de45b10b39d0dc9e8cd53.jpeg | https://i5.walmartimages.com/asr/6d4fd567-f354-40dc-85c7-671fcd3e3a3d.8846fc389fa7c3d56f10aeeff5f42b98.jpeg | https://i5.walmartimages.com/asr/d0f90046-2519-47a2-a2d1-0e5365b93867.9edeeae591256360f84ff5cfb62bbdbc.jpeg,No Ratings Available,"We believe in the power of blends to provide nourishing care for your hair. If your hair is prone to frizz, we have a blend for you. Our velvety formula brings sustainably sourced Coconut Oil, known to soften, together with Cocoa butter extracts. As a Whole Blend, it smooths frizz for 24-hours and tames flyways*. Coconut Oil for Hair contains super hydrating properties, its ideal in formulas that help combat frizz, prevent damage, and boost smoothness and shine. *When using the Garnier Whole Blends Smoothing system of shampoo & conditioner. Whole Blends Smoothing Shampoo provides 24 hour frizz control Formula blended with sustainably sourced Cocoa Butter known to soften and Coconut Oil, a legendary smoother Paraben-free and gentle enough for everyday use For every blend, thereâ€™s Whole Blends, hair care blended with purpose","beauty, hair, care, shampoo, shampoo",347.0
8eeadaee7a33be02bb1c19352db9badf,"Palmers Skin Success Eventone Anti Bacterial Medicated Complexion Bar Vitamin E, 3.5 oz - (Pack of 3)",1.0,palmer,https://i5.walmartimages.com/asr/87f98188-ad3c-41d0-b59a-84be82e3e97e_1.1a05d04b3db2968198c61ab37b37454a.jpeg | https://i5.walmartimages.com/asr/0de60286-f3b3-4993-98a6-b94c06fd7859.bc3549080b7e7b310d1b1a4c39921d2a.jpeg,5.0,"Pack of 3 for the UPC: 010181173806 Product DescriptionUse palmers skin success eventone complexion soap for cleaner, evenly toned skin. Formulated to leave skin thoroughly clean without over drying, it helps eliminate clogged pores that can lead to blemishes. Vitamin E softens and protects, revealing a smoother more balanced complexion. Palmers skin success eventone complexion soap rinses clean away, so skin never feels tight or uncomfortable. Cleanses skin without over drying Helps eliminate clogged pores Leaves smoother more balanced complexion Vitamin E softens and protects 3 Pack - Palmers Skin Success Eventone Anti Bacterial Medicated Complexion Bar Vitamin E, 3.5 oz","beauty, skin, care, skin, care, sets",1421.0
0e666b2bd711cf5077d0e7f146fedfe5,J.R. Watkins Tub and Tile Cleaner Spray Orange Scent,7.0,watkins,https://i5.walmartimages.com/asr/29e66b1a-78b7-4ae0-9042-f0b07774cc70.a30714e78fe7c1d4edb641ee6a8b0a57.jpeg | https://i5.walmartimages.com/asr/255a91ff-fa85-44e4-bd43-9e76daa8965c_1.dbba1fd592b9c29bc284424685689ace.jpeg,No Ratings Available,"When natural cleaning is the goal, reach for J.R. Watkins. For a sparkling tub, tile and shower fixtures with a lingering citrus scent, use J.R. Watkins Tub and Tile Cleaner Spray. Each 24 fl. oz. trigger sprayer bottle tackles tough water stains and soap scum with ease. 99.74% natural solution is phosphate-free, so it works great, even for people with sensitive skin. Ammonia-free, bleach-free, dye-free, sodium lauryl sulfate-free. Safe for septic systems and environmentally friendly.  Watkins Tub & Tile Cleaner Spray Citrus, 24 Fl Oz","household, essentials, bathroom, bathroom, cleaners",1295.0
f5dbe6fea7f833e6154b059fde49d71e,Citronella Essential Oil - 1/6 fl oz (5 ml) Glass Bottle w/ Euro Dropper - 100% Pure Essential Oil by GreenHealth,9.0,greenhealth,https://i5.walmartimages.com/asr/b3d479f9-64cf-4422-aad6-fc58f2d32956_1.3f4b7bef22c09be9094875077332d074.jpeg | https://i5.walmartimages.com/asr/02414166-7cbc-4537-ad7c-81e049d94578_1.535fff3ad34cc437e5ac0b23753aa8c7.jpeg,4.8,"Citronella oil is extracted from a resilient grass (Cymbopogon nardus) native to Sri Lanka and Java. It is a very aromatic perennial that grows approximately 1 meter (3 feet) in height. Disclaimer: Please note, the International Federation of Aromatherapists do not recommend that Essential Oils, Carrier Oils, or Hydrosols be taken internally unless under the supervision of a Medical Doctor who is also qualified in clinical Aromatherapy. Citronella Essential Oil by GreenHealth Botanical Name:  Cymbopogon nardus Aromatic Scent:  Citrusy, slightly fruity, fresh, sweet.","health, aromatherapy, essential, oils, essential, oils",499.0
a7a7156ce12965cf88c23f02107402d6,"Revlon ColorStay Overtime Lipcolor, Long Wearing Liquid Lipstick - 24/7 Pink",480.0,revlon,https://i5.walmartimages.com/asr/45ea8c0d-ed07-4570-973c-e5bf5358c3ab_1.39560340eb4eda99db1e5b044fe25bcc.jpeg | https://i5.walmartimages.com/asr/6eff7b62-4115-4131-bab8-29f5b65e72b4_1.bd3515c376b1674cf2f348363c02d5a2.jpeg | https://i5.walmartimages.com/asr/78772f36-4aee-4835-91f0-8f60aeaf26a6_1.3e504b5c1343f18ce1c5610add07b9ff.jpeg | https://i5.walmartimages.com/asr/478c9407-897f-4856-bc14-ff7a869119c2_1.993ee391e8372b5c65593955d5b1c159.jpeg | https://i5.walmartimages.com/asr/e26b2733-9b27-43ad-95ce-6356f22e2928_1.136cb3879fcde68a848c96f694a2ed6f.jpeg | https://i5.walmartimages.com/asr/19dd5d0a-1dad-4354-95f2-1ba381a9c33c_1.f2679efdde954369d63702807ae5b081.jpeg | https://i5.walmartimages.com/asr/b7c1293f-55df-4ede-b978-549da3c35c12_1.34638f1436dd2794127ae5519b1ee68f.jpeg | https://i5.walmartimages.com/asr/16ad8c3d-7bff-42d9-b40d-92f4b8ea10f3_1.5d8c08867e59be8d63856c6c4f51fa40.jpeg,4.2,"Revlon ColorStay Overtime Lipcolor is a dual-ended long-wearing lipstick thats transfer-proof, kiss-proof, so you can forget touch-ups throughout your day or night. Get shiny lip color that doesnt smudge off or rub off, and conditions with vitamin E. One end smoothes on our long-wearing ColorStay liquid lipstick—weve made it extra plush, so it feels soft on your lips and the other end is loaded with a clear lip gloss, that acts as a top coat, for a slick look. The upgraded clear lip gloss contains ingredients, including vitamin E (for even more comfort, plus moisture!), chamomile, and soy extract. Youll get color that never feels dry, bleeds or feathers. Its available in 30 lipstick colors ranging from reds, nudes, browns, pinks, and plums. Forget touch-ups: This transfer-proof, kiss-proof longwearing lipstick wont let you down. The color is vibrant, and the creamy formula stays put for up to 16 hours without smudging One end smoothes on our longwearing ColorStay liquid lipstick—weve made it extra plush, so it feels soft on your lips. The other end is loaded with a clear lip gloss, that acts as a top coat, for a slick look The upgraded clear lip gloss contains ingredients, including vitamin E (for even more comfort, plus moisture!), chamomile, and soy extract Our promise: You get color that never feels dry, bleeds, or feathers Available in 30 shiny, kiss-proof lipstick colors ranging from reds, nudes, browns, pinks, and plums This item was formulated without Sulfates, Parabens, or Phthalates","beauty, beauty, topic, mindful, beauty, mindful, beauty, cosmetics",675.0
44b4f5c7e0bc33566f499bc9b4533cee,Super Colon 1800 Weight Loss Detox Cleanse All Natural with Acai Fruit and Fennel Seeds 60 Capsules Per Bottle (10 bottles),No Reviews Yet,maritzmayer,https://i5.walmartimages.com/asr/ac11c894-0064-4ffb-b40b-1ad3bbb38a50_1.0a09bb8e455424ae7661b463f5e3350e.jpeg | https://i5.walmartimages.com/asr/c1ca8e5e-a2ff-4b90-83fb-ceecab231951_1.343c7df69e5cb72d792ff4b0c0bf26ad.jpeg,No Ratings Available,"Super Colon 1800 is a digestive health support supplement, formulated with ingredients to help support detoxification, such as Cascara Sagrada, Cape Aloe, probiotics, and more.","health, superfoods, cleanses, colon, cleanse",5270.0
62cb6424bfe6f4cc38489c44b1ceaadf,"Almay Eye Makeup Remover Pads, Longwear & Waterproof 80 ea (Pack of 3)",No Reviews Yet,almay,https://i5.walmartimages.com/asr/ede7f7fb-65d2-4855-81ba-ecda1fe815b1_1.cda3055df6c021def7811e3c7579c1b1.jpeg,No Ratings Available,"Free Shipping Pack of 3 Pack of 3 for the UPC: 309975924480 Gently removes all traces of eye makeup, even stubborn waterproof mascaras and longwearing products. Ingredients:  Paraffinum Liquidum (Mineral Oil), Propylene Glycol Dicaprylate/Dicaprate, C12 15 Alkyl Benzoate, Aloe Barbadensis Leaf Extract, Cucumis Sativus (Cucumber) Fruit Extract, Camellia Sinensis Leaf Extract, Phenoxyethanol, Methylparaben, Propylparaben","beauty, skin, care, makeup, remover, almay, makeup, removers",2083.0
e8cc3d9760fa42a1b90e4606942b6ad8,"Rimmel London Oh My Gloss! Oil Lip Tint, Master Pink",1423.0,rimmel,https://i5.walmartimages.com/asr/26ebd838-1de7-4743-b322-8d7a23c3f3c8_1.dbe745e4d1086bc3c50560529cd9a267.jpeg | https://i5.walmartimages.com/asr/355050e9-b95c-4da1-b988-47b88619b838_1.97c3871e9ecc2977b1beda30805cd6a2.jpeg | https://i5.walmartimages.com/asr/a07b4f27-95b0-4329-9afc-9ed4c9640bdd_1.63fa3f8f51448c8e5a86d8bfdf3dedce.jpeg | https://i5.walmartimages.com/asr/2d3ce68b-a204-4164-b46a-bde2e914e9f1_1.62b7b29c9bbf0147317a6e3587704770.jpeg | https://i5.walmartimages.com/asr/44007130-7579-46db-9789-69e4cb7e4681_1.71e4ea65d60aa0addd6c0bbbd59995d1.jpeg,No Ratings Available,"Pamper your pucker with Rimmel London Oh My Gloss Oil Tint. This latest innovation from Rimmel London is more than just your average gloss. The richly hydrating balm takes shine to new heights with an oil-based formula that nourishes lips with extra moisture. Rimmel lip glosss sheer finish imparts beautiful color but is translucent enough to let the natural beauty of your lips shine through. The unique formulation infuses lips with superior moisturizers to keep lips soft, supple and beautiful. The oil based lip gloss can be used alone for a hint of tint or layered over your favorite Rimmel London lip colors for non-stop shine. The high-gloss finish is never sticky or tacky. Choose from six gorgeous shades, including three pink shades, coral and red, to best suit your style. Rimmel London Oh My Gloss! Oil Lip Tint, Master Pink: Available in six different sheer shades: Contemporary Coral, Modern Pink, Orange Mode, Smart Pink, Master Pink and Pop Poppy Oil-based Rimmel lip gloss for extra moisture High-gloss finish is ideal worn alone or layered over your favorite Rimmel London lipstick shades Rimmel lip gloss is never sticky and is comfortable to wear Adds a flush of sheer color thats ideal for just about any occasion","beauty, beauty, brands, rimmel, rimmel, lip, makeup",634.0
c5fb686100509df6b6a81c3b3334706c,"Clarins Bust Beauty Firming Lotion, 1.7 Oz",No Reviews Yet,clarins,https://i5.walmartimages.com/asr/324a4e6a-0bad-403e-8b15-e320e8a8eff7_1.5b828455b994356c4f7613601ef39de1.jpeg | https://i5.walmartimages.com/asr/9bd60b3b-86df-41bd-bff0-54dc0ac27859_1.272787f909d5cf67f6424969babe39b6.jpeg,No Ratings Available,"This high-quality product from a trusted brand offers exceptional value and reliability. Carefully curated to meet your daily needs, it is designed for your convenience and satisfaction. ","premium, beauty, premium, bath, body, premium, body, lotions",2750.0
24a8c95f41554008b0c94522c75d8915,(3 Pack) O MY! Goat Milk Soap - Vanilla Sandalwood 6 OUNCE,No Reviews Yet,o,https://i5.walmartimages.com/asr/1f7fa832-019c-48b2-b0bd-d76145b9d397_1.a38f89df12d2cead80eaee36aa8a25e3.jpeg,No Ratings Available,O MY! Goat Milk Soap - Vanilla Sandalwood 6 OUNCE sold as single and value multi-packs. Buy in quantity and save! (3 Pack) O MY! Goat Milk Soap - Vanilla Sandalwood 6 OUNCE,"personal, care, bath, body, bar, soap",2250.0
6bb02248288f847ba8a36613f977c45f,"Garnier SkinActive Moisture Rescue Face Moisturizer, Normal/Combo, 1.7 oz.",732.0,garnier,https://i5.walmartimages.com/asr/95369513-e8a0-4a7c-a78e-a60795df1274.692d955320ae03c00b12e4da1481455b.jpeg | https://i5.walmartimages.com/asr/20aee852-ac07-496c-9667-75a085b095a1.8ef701fb09a093663bbf42a75572fdcf.jpeg | https://i5.walmartimages.com/asr/83a8ede0-e575-4a3f-babb-e6e7f0bf7829.bcb1949c7e3d5ad2b665fade17f678df.jpeg | https://i5.walmartimages.com/asr/23917464-776b-4ead-8876-b550438c41fe.3bc822102b984c04346a128bae9f8873.jpeg | https://i5.walmartimages.com/asr/ab0ea22b-0545-4531-8fc1-e9241b3c1be7.4c37c6a241d3515ebf6a4047d0963e13.jpeg | https://i5.walmartimages.com/asr/50175fae-1c00-4446-8213-6147399dabc3.ab69315b70235a3c9fe498329774eaf8.jpeg | https://i5.walmartimages.com/asr/be488922-b9d1-4674-ad92-0da7a8f656c1.715aa8c3b63dab57a71a4e3e6f50c8c1.jpeg,No Ratings Available,"This oil-free, gel-cream face moisturizer with Vitamin E and Fruit Water Antioxidant Complex provides 24-hour hydration and protects and defends against moisture loss. This water-light non-comedogenic face moisturizer does not clog pores. In one use, this facial moisturizer leaves skin feeling deeply hydrated, softer and smoother. Suitable for all skin types, especially dry skin. *In a consumer test. Oil-free gel-cream face moisturizer with Vitamin E and Fruit Water Antioxidant Complex Face moisturizer for normal to combo skin provides 24-hour hydration and helps protect skins barrier Non-comedogenic facial moisturizer that does not clog pores In one use, skin is hydrated, softer and smoother","beauty, skin, care, moisturizers, facial, moisturizers, sensitive, skin",662.0
0f87b5f502ed5b0ed687b3bb5dc45685,Andalou Naturals Body Lotion Mandarin Vanilla,2.0,"andalou, naturals",https://i5.walmartimages.com/asr/f8dbba22-d8d9-4db0-96c9-27cbe28c1df7_1.f504844aaf64d8c3ca74538fa52262a5.jpeg | https://i5.walmartimages.com/asr/7ee2173d-67d2-403b-b231-a87ed3f12245_1.5072f3925f61a6e21a6d2e9852d33909.jpeg,No Ratings Available,"Superfruit antioxidants, rosehip + argan oils, shea + cocoa butters, ultra-hydrating aloe vera.Verified gluten free. Vegan.Non GMO. Non GMO Project Verified. nongmoproject.org.Natures intelligence fruit stem cell science. This ultimate skin food blends emollient rich rosehip and argan oils with shea and cocoa butters to nourish, smooth, and soften the appearance of dry skin. Vitalizing mandarin vanilla delights the senses as superfruit antioxidants and ultra-hydrating aloe vera help protect and uplift skins moisture barrier for a luxurious, all-over body treatment. Beauty is you. Nature 99% derived. To Use: Apply over body; absorbs quickly for satin smooth skin.Good for 12 months once opened. New Look Non GMO Superfruit Antioxidants Rosehip + Argan Oils Shea + Cocoa Butters","personal, care, bath, body, body, lotions, creams",1361.0
6735fc519eb0d4dc5180c482bc4606b5,Quart Belloccio Simple Tan 12% DHA Dark Sunless Airbrush Spray Tanning Solution,1.0,belloccio,https://i5.walmartimages.com/asr/57ffec3e-4d79-4520-934a-4a1b04c8b619_1.eec4d5c9e90bf683761a0d54ce6e193c.jpeg,5.0,"1 Quart of Belloccio Simple Tan Professional Salon Sunless Tanning Solution with 12% DHA and Dark Bronzer Color GuideBelloccio, the most popular and trusted brand of tanning solutions in the industry.Simple Tan is a super premium natural tanning solution that delivers long-lasting beautiful natural-looking tans that last for 7 to 10 days. Its formulated with a special proprietary blend of vitamins and antioxidants that help revitalize, tighten and moisturize the skin while creating an even, flawless, natural-looking golden tan.Professional Salon Formula.Anti-aging skin nourishing ingredients.Hydrating organic aloe vera based.Fast drying, streak-free and odor-free.Pleasant fresh citrus scent.Paraben free.The 12.5% DHA formula works best with medium to dark complexion skin tone types. (olive, caribbean, latin, mediterranean, etc...) It contains dark bronzer color guide that provides an immediate bronze color to aid you in even application. Belloccio Simple Tan 8% & 10% DHA Medium and 12% DHA Dark are made in: 4 ounce, pint, quart, half gallon and gallon sizes. Quart Belloccio Simple Tan 12% DHA Dark Sunless Airbrush Spray Tanning Solution Professional Salon Formula. Anti-aging skin nourishing ingredients; Hydrating organic aloe vera based. The skin firming and moisturizing formula contains a highly concentrated antioxidant blend of ingredients that help revitalize, restore and renew the skin. Fast drying, streak-free and odor-free; Pleasant fresh citrus scent; Paraben free. Belloccio Simple Tan 8, 10 and 12% DHA are made in: 4 ounce, pint, quart, half gallon and gallon sizes","personal, care, sun, care, self, tanners, bronzers",3396.0
d6e059294bb5a4282db6e65b5affa0d2,Simply Smooth 8686183 By Simply Smooth Xtend Keratin Reparative Magic Potion 8.5 Oz,3.0,"simply, smooth",https://i5.walmartimages.com/asr/8203fc30-16a4-4208-8223-90ebf842965f_1.04c85ea8194ff766b21ec76ce815492c.jpeg | https://i5.walmartimages.com/asr/19a5958c-de94-4d39-9dda-8554d416eb5e_1.78628b06a18377549c960c350097bb88.jpeg,5.0,"This high-quality product from a trusted brand offers exceptional value and reliability. Carefully curated to meet your daily needs, it is designed for your convenience and satisfaction. ","premium, beauty, premium, hair, care, hair, tools, premium, styling, products, premium, hair, styling, products",1418.0
7b49c75950540a191509d7dffcc0a373,Banana Boat Sunscreen Lip Balm Aloe Vera With Vitamin E SPF 45 0.15 oz,1.0,"banana, boat",https://i5.walmartimages.com/asr/1c01447a-af70-4d86-96ca-2d648ca26785_1.3ae03bebbfaf61c519fbb742a49ccef4.jpeg,5.0,"Banana Boat Sunscreen Lip Balm Aloe Vera With Vitamin E SPF 45 0.15 ozCelebrate the sun!Sunscreen, Lip BalmEnergizer PcActive Ingredients:Avobenzone 2.00%; Octocrylene 10.00%; Oxybenzone 6.00%Apply before sun exposure and as needed. Sun Alert: Limiting sun exposure, wearing protective clothing, and using sunscreens may reduce the risk of skin aging, skin cancer and other harmful effects of the sun.Inactive Ingredients:Petrolatum; Polyethylene; Ethyl Palmitate; Trimethylsiloxyphenyl Dimethicone; Microcrystalline Wax; Isopropyl Myristate; Theobroma Cacao (Cocoa) Seed Butter; PEG-8; Aloe Barbadensis Leaf Extract; Tocopheryl Acetate (Vitamin E); Ascorbic Acid (Vitamin C); Retinyl Palmitate (Vitamin A); Silica; Caprylyl Glycol; Sodium Saccharin; Fragrance; Propylparaben; Butylparaben Uses:Helps prevent sunburn. Banana Boat Aloe Vera and Vitamin E Lip Balm is very water/sweat resistant and moisturizes and soothes dry chapped lips. This ultra-sheer formula with patented AvoTriplex technology protects in 3 ways: 1. Against sunburn with high UVB protection, 2. Against the effects of aging and long term skin damage with high UVA protection, and 3. Lasts longer than ordinary sunscreens since it doesnt break down.Stop use and ask a doctor if: rash or irritation develops. Keep out of reach of children. If swallowed, get medical help or contact a Poison Control Center right away.","beauty, makeup, lip",407.0
aef76f92d31441110fe91f55c44fd86a,2 Pack - LOreal Paris RevitaLift Double Lifting Eye Cream/Gel 0.50 oz,47.0,professionnel,https://i5.walmartimages.com/asr/37378053-c0dc-4d23-8bda-7cf4bb70fb4c_1.dfd11de52f75dbe4a7815a5119da63e4.jpeg | https://i5.walmartimages.com/asr/edef885b-f628-4cd9-87bf-8ebc35d499c0.5433f1f8d481e6e0e8d9f3bab902d3c1.png,No Ratings Available,"This high-quality product from a trusted brand offers exceptional value and reliability. Carefully curated to meet your daily needs, it is designed for your convenience and satisfaction. ","premium, beauty, premium, facial, skincare, premium, eye, cream, treatments",2445.0
74b3df55cf8f2f6b0bfc34bc9fd0c7d9,Product of Clorox Toiletwand with 36 Disposable Cleaning Heads - Cleaning Tools [Bulk Savings],1.0,"product, clorox",https://i5.walmartimages.com/asr/53466600-67e4-4f17-adde-fe3b85bbe705_1.a1ee0ce077088353ed82ca17f7ab4d1f.jpeg,No Ratings Available,Product of Clorox Toiletwand with 36 Disposable Cleaning Heads - Cleaning Tools [Bulk Savings],"household, essentials, bathroom, bathroom, cleaners",2349.0
